{
  "schema_version": 1,
  "catalog_version": "2026.09.13-node14.1-candidate",
  "e2e_commit": "2cad5602158fd2e4836d821d644a2b8d92f571a2",
  "capability_abi": 1,
  "actions": [
    {
      "action_key": "node.add",
      "revision": "4",
      "status": "candidate",
      "capability": "node.add.v1",
      "input_schema": {
        "type": "object",
        "properties": {
          "component_key": {
            "type": "string",
            "enum": [
              "preprocessing.data_recovery",
              "imports.text",
              "imports.lgd",
              "transform.group_data",
              "transform.calculator",
              "transform.union_data",
              "transform.col_union_data",
              "transform.reform_columns"
            ]
          },
          "target_position": {
            "type": "object",
            "properties": {
              "x": {
                "type": "number",
                "minimum": 8,
                "maximum": 10000
              },
              "y": {
                "type": "number",
                "minimum": 8,
                "maximum": 10000
              }
            },
            "required": [
              "x",
              "y"
            ],
            "additionalProperties": false
          },
          "expected_label": {
            "type": "string",
            "minLength": 1,
            "maxLength": 200,
            "pattern": "^[^;|<>\\\"'\\\\\\r\\n]+$"
          }
        },
        "required": [
          "component_key",
          "target_position"
        ],
        "additionalProperties": false
      },
      "output_schema": {
        "type": "object",
        "properties": {
          "auto_created_links": {
            "type": "array",
            "items": {
              "type": "string",
              "minLength": 1,
              "maxLength": 2000
            }
          },
          "goal_verified": {
            "type": "boolean",
            "enum": [
              false
            ]
          },
          "node_ref": {
            "type": "object",
            "properties": {
              "kind": {
                "type": "string",
                "enum": [
                  "node"
                ]
              },
              "node_label": {
                "type": "string",
                "minLength": 1,
                "maxLength": 200
              },
              "workflow_ref": {
                "type": "object",
                "properties": {
                  "tab_tid": {
                    "type": "string",
                    "minLength": 1,
                    "maxLength": 1000
                  },
                  "prefix": {
                    "type": "string",
                    "minLength": 1,
                    "maxLength": 1000
                  }
                },
                "required": [
                  "tab_tid",
                  "prefix"
                ],
                "additionalProperties": false
              }
            },
            "required": [
              "kind",
              "node_label",
              "workflow_ref"
            ],
            "additionalProperties": false
          }
        },
        "required": [
          "auto_created_links",
          "goal_verified",
          "node_ref"
        ],
        "additionalProperties": false
      },
      "selector_symbols": [
        "megaladata.ready_avatar",
        "workspace.active_tab",
        "workflow.graph",
        "workflow.workarea",
        "workflow.node",
        "workflow.node_label",
        "component.preprocessing.data_recovery",
        "component.imports.text",
        "component.imports.lgd",
        "component.transform.group_data",
        "component.transform.calculator",
        "component.transform.union_data",
        "component.transform.col_union_data",
        "component.transform.reform_columns"
      ],
      "evidence": [
        {
          "path": "bg/helpers/workflow/node.ts",
          "line_start": 77,
          "line_end": 120,
          "commit": "2cad5602158fd2e4836d821d644a2b8d92f571a2",
          "sha256": "c50802326ad3b32bcceb35e892606bae5726eaaafab0fd5d833f26dfb6ebea64",
          "role": "helper"
        },
        {
          "path": "bg/selectors.ts",
          "line_start": 285,
          "line_end": 408,
          "commit": "2cad5602158fd2e4836d821d644a2b8d92f571a2",
          "sha256": "59f5ed385076a5ca4cb97827647bbbca49da9380717fb44f204aa415e4b4e9e3",
          "role": "selectors"
        }
      ],
      "preconditions": [
        "selected workspace tab resolves to one active workflow",
        "component and workarea resolve to one stable visible element",
        "Megaladata mask is absent"
      ],
      "postconditions": [
        "graph snapshot contains exactly one new root node",
        "returned node_ref resolves in the active workflow",
        "requested label and target geometry are verified when supplied",
        "preexisting graph content is preserved; automatic links incident to the new node are returned for agent review"
      ],
      "effect": {
        "kind": "create",
        "resource": "workflow.node"
      },
      "idempotency": {
        "policy": "reconcile_before_retry",
        "reconcile": "graph node snapshot diff"
      },
      "timeout_ms": 60000,
      "retry_budget": 0,
      "required_capabilities": [
        "node.add.v1"
      ],
      "min_executor_revision": "1.1.0",
      "cleanup": [
        "release mouse input",
        "leave the newly created node selected only if Megaladata selected it"
      ]
    },
    {
      "action_key": "link.create",
      "revision": "1",
      "status": "candidate",
      "capability": "link.create.v1",
      "input_schema": {
        "type": "object",
        "properties": {
          "source_node": {
            "type": "object",
            "properties": {
              "kind": {
                "type": "string",
                "enum": [
                  "node"
                ]
              },
              "node_label": {
                "type": "string",
                "minLength": 1,
                "maxLength": 200,
                "pattern": "^[^;|<>\\\"'\\\\\\r\\n]+$"
              },
              "workflow_ref": {
                "type": "object",
                "properties": {
                  "tab_tid": {
                    "type": "string",
                    "minLength": 1,
                    "maxLength": 1000
                  },
                  "prefix": {
                    "type": "string",
                    "minLength": 1,
                    "maxLength": 1000
                  }
                },
                "required": [
                  "tab_tid",
                  "prefix"
                ],
                "additionalProperties": false
              }
            },
            "required": [
              "kind",
              "node_label",
              "workflow_ref"
            ],
            "additionalProperties": false
          },
          "target_node": {
            "type": "object",
            "properties": {
              "kind": {
                "type": "string",
                "enum": [
                  "node"
                ]
              },
              "node_label": {
                "type": "string",
                "minLength": 1,
                "maxLength": 200,
                "pattern": "^[^;|<>\\\"'\\\\\\r\\n]+$"
              },
              "workflow_ref": {
                "type": "object",
                "properties": {
                  "tab_tid": {
                    "type": "string",
                    "minLength": 1,
                    "maxLength": 1000
                  },
                  "prefix": {
                    "type": "string",
                    "minLength": 1,
                    "maxLength": 1000
                  }
                },
                "required": [
                  "tab_tid",
                  "prefix"
                ],
                "additionalProperties": false
              }
            },
            "required": [
              "kind",
              "node_label",
              "workflow_ref"
            ],
            "additionalProperties": false
          },
          "source_port": {
            "type": "object",
            "properties": {
              "kind": {
                "type": "string",
                "enum": [
                  "data",
                  "var",
                  "order",
                  "tree",
                  "connection"
                ]
              },
              "index": {
                "type": "integer",
                "minimum": 0,
                "maximum": 999
              }
            },
            "required": [
              "kind"
            ],
            "additionalProperties": false
          },
          "target_port": {
            "type": "object",
            "properties": {
              "kind": {
                "type": "string",
                "enum": [
                  "data",
                  "var",
                  "order",
                  "tree",
                  "connection",
                  "control_var",
                  "add"
                ]
              },
              "index": {
                "type": "integer",
                "minimum": 0,
                "maximum": 999
              }
            },
            "required": [
              "kind"
            ],
            "additionalProperties": false
          }
        },
        "required": [
          "source_node",
          "target_node",
          "source_port",
          "target_port"
        ],
        "additionalProperties": false
      },
      "output_schema": {
        "type": "object",
        "properties": {
          "link_ref": {
            "type": "object",
            "properties": {
              "kind": {
                "type": "string",
                "enum": [